Spark Gap Telegraph,"Telegraph that highlights the spark gap, an invention that was instrumental to the development of the product. ",8 - 16,2,"telegraph, history, morse code, communication, engineering",No,3,> 1 min,"Wireless Telegraph
In the late 1800s, the telegraph was the only way to send an instant message to someone. The telegraph transformed the world and made communication much easier across distances. The problem was wires. You can't run wires from the shore to a ship, and ships were incredibly important to the global economy. People needed instant communication everywhere, and they needed to get rid of the wires. Warren Johnson's initial transmitter set-up consisted of a battery, a capacitor, an induction coil, and a spark gap. When you complete the circuit, the induction coil transforms low-voltage electricity from the battery into a high-voltage impulse, which jumps across the gap. This generates a pulse of radio waves that flies off in every direction. A coherer (radio-wave receiver) located somewhere else picks up this pulse of radio waves as a burst of static. A short burst of static became a Morse Code dot. A longer burst became a dash. Eventually, Johnson and his engineer Charles Fortier demonstrated their wireless telegraph system at the 1900 Paris Exposition with luminaries like Nikola Tesla, Guglielmo Marconi, and Thomas Edison.",
Telegraph with Key,Telegraph with an accompanying morse code key where users are encouraged to spell out different words in morse code. ,8 - 16,2,"telegraph, history, morse code, communication, engineering",No,3,> 1 min,"Morse Code
It's 1836. Your name is Samuel Morse. You're a portrait painter and inventor originally from Charlestown, Massachusetts. Your job is to figure out a way to send instant messages across the country. You have a transmitter that allows you to send electrical impulses. You have a receiver that receives electrical impulses. You have electricity. You have wire. What do you do?
I Could Create a Code!
You could create a code. Each letter might be combination of short and long bursts of electricity. Dots and dashes (and empty space). Tiny bits of empty space between letters. Longer bits of empty space between words. You want your code to be as efficient as possible, so you assign the shortest series of dots and dashes to the letters we use most frequently. 'E' would be a single dot. 'T' would be a dash. ‘I' would be two dots. 'M' would be two dashes. And so on. Congratulations. You've invented Morse Code.",
Thermostat,Model thermostat that shows an early model of the invention.,8 - 18,2,"building automation, weather, history, HVAC",No,5,> 1 min,"Origin of the Thermostat
Let's go back in time. 130 years should do it. Nice time machine, by the way. It's the late 1800s in Whitewater, Wisconsin. You're a professor. Your classroom is freezing. Your students are shivering in their coats and sweaters. Suddenly, a janitor opens the door and pops his head in, disrupting your class. He takes a look at the thermometer on the wall and pops out. The janitor runs down to the basement and turns on the boiler. Hot air starts surging through the vents. Your students start tearing off their coats and sweaters in an attempt to get comfortable. Now they're disrupting the class. Your classroom is never comfortable. Interruptions plague your lecture. How are you supposed to teach? How are your students supposed to learn? You get frustrated. If you're Warren Johnson, you turn that frustration into a brand new innovation called the thermostat.",
Ding Dong,Device that Les Paul invented to test the magnetic quality of guitar strings. ,12 +,3,"Les Paul, guitars, inventions, physics, history, music",No,5,> 1 min,"Ding Dong
Nicknamed, ""The Ding Dong"", Les built it to test the magnetic quality of strings, which strings produced the most voltage, and what sound quality he could expect from plucking strings high versus low, etc. He quickly realized the benefit of this method. While other record producers and recording artists relied on electronic mixers to balance and engineer the sound, he was engaged in sound manipulation on the most basic levels. Les reveled in the subtleties.",
Hometown Tour,Interactive digital map that lets the user select various locations in Waukesha and see how they related to Les Paul's life. ,All Ages,1,"Les Paul, history, Wisconsin, map, music",No,3,2 - 5 mins,"Take The Tour
Join Sue Baker, The Program Director at the Les Paul Foundation on a tour of Les Paul's Home Town, Waukesha, WI. See where Les lived, learned, performed and invented.",
How Many Discs?,"500 vinyl records stacked on top one another to show a visual on how many discs Les Paul had to go through when recording his song ""Lover.""",All Ages,2,"Les Paul, history, invention, music",No,3,> 1 min,"How Many Discs Does it Take to Create a New Sound?
Five hundred, give or take a tew. Computers have made it easy to record multiple tracks, overdub, and add effects. But the combination of these effects had never been done before Les Paul released ""Lover"" in 1948. He called his effects ""The New Sound."" It was a huge hit.
It was a complicated process. If he didn't like a particular take, he couldn't record over it. He had to start over with another disc.",
Les & Leo,"Visual experience that shows a 1951 Telecaster, the first solid-body electric guitar that Les Paul was heavily involved in the invention of. Guests can read about the friendly rivalry between Les Paul and Leo Fender.  ",8 - 18,2,"Les Paul, Leo Fender, Gibson, Fender, guitar, electric-guitar, history, rivalry, invention, music",No,5,,"Les & Leo
Gibson vs. Fender is one of music history's most iconic rivalries, yet Leo Fender and Les Paul shared a surprising friendship. Leo, a passionate electronics tinkerer who didn’t actually play guitar, started with a radio repair studio where he made his name selling musical equipment like public address systems, amplifiers, and Hawaiian guitars. He would often visit Les Paul's garage studio in L.A. where they discussed electronics and solid-body electric guitars. Leo created his first electric guitar prototype based off these visits and offered it to Les, inviting him to join Fender, but Les chose to stay with Gibson. The Telecaster, available in 1951, was the world’s first mass-produced and commercially successful solid-body electric guitar. Initially mocked for resembling a boat paddle, musicians soon discovered that Fender had provided them with a great-sounding, easily playable, and affordable instrument. It quickly became one of the most influential sounds of the 20th century, shaping the evolution of Rock 'n' Roll, R&B, and Country music. Seeing the success of Fender's Telecaster, Gibson got back in contact with Les Paul to create their own electric guitar. Les, who had figured out much of the invention in the decade earlier, said, “Fender was out first but I was way, way, way out front,” allowing for the quick release of the Gibson Les Paul in 1952. Les acknowledged Leo Fender's impact, stating, ""Leo did me a favor. I couldn't move Gibson with an atomic bomb. It took Leo Fender to wake Gibson up."" This rivalry spurred innovation, shaping their distinct guitar sounds.",
Les' First Invention,Users can view the first ever neck-mounted harmonica holder with a small blurb of accompanying text. ,All Ages,1,"Les Paul, history, invention, harmonica, music",No,5,,"Les' First Invention
Flip-able harmonica holder
Harmonica holders were available in the 1920s, but they held the harmonica in one position. When he was around 13 years old, Les was playing his guitar and harmonica in public. He wanted to be able to play both sides of his harmonica in order to change keys without putting his guitar down, so he invented a flip-able harmonica holder from metal coat hangers and a piece of wood. His design has evolved into a readily available product.",
Meeting Mary Ford,Small copy-based experience that highlights the origins of Les Paul and Mary Ford's relationship.,12 - 18,1,"Les Paul, Mary Ford, music, history",No,5,,"Meeting Mary Ford
Iris Colleen Summers was Mary Ford's birth name. She was one of seven musical siblings whose father was a revival preacher. In 1944, Colleen was backing country singers as part of the Sunshine Girls trio. At the same time, Les Paul was living in Hollywood and looking for a female singer for his country music radio show. A friend suggested he listen to the Sunshine Girls. Les was impressed and called Colleen to audition. Colleen's friends knew she was a huge Les Paul fan. Surely one of her friends was pulling a prank. But she agreed to the audition. When the evening for the audition came, Les forgot about the meeting. He was mowing his lawn in a checkered shirt, baggy army pants and his old army boots. He hadn't even shaved. Colleen pulled up, ""Can you tell me where the Les Paul studios are?"" She followed Les' directions to the garage recording studio. The only way in was to climb through a window. Quite a bit later when Les crawled through the window, Colleen exclaimed, ""That's not Les Paul! That's the gardener!"" As she scrambled for the exit, Les picked up his guitar and let go with a fast run. Colleen stopped, ""Oh my, you are Les Paul."" For the radio show Colleen was ""Mary Lou."" Later, while the two were in Wisconsin, Les decided Colleen needed a new stage name. He picked up a Milwaukee phone book. They settled on ""Mary Ford.""",
Persistence,"Informational copy based experience where guests can learn about the times when Les was faced with hardship in his career, but still persisted through.",12 +,1,"Les Paul, history, Gibson, reading-heavy, music",No,5,,"Persistence
Focusing on the Future
When Les was 32, he and Mary Skidded off an icy bridge and down a ravine. Mary wasn’t badly hurt, but Les was a mess of broken bones. One doctor advised amputating Les’ shattered right arm, but Dr. Robert Knight - a fan - saved it. The best option was the fix the arm in place. Les had the surgeon set it so he’d still be able to play. During recovery, Les focused on his future. “The doctors said there was potential nerve damage, that I shouldn’t count on regaining full use of the hand, but I wasn’t buying it. I was determined it was going to come back and that I would play again.”
Meeting Bing
Bing Crosby’s weekly NBC radio show was the top show in America, and a 29-year-old Les Paul wanted to be on it. He didn’t know Bing, but left New York determined to meet him in Hollywood. After becoming a staff musician at NBC, Les noticed Bing’s habit of going into a tiny room for a few minutes of quiet before the show. One day, Les had his trio in that room rehearsing a hot number when Bing walked in. Bing hired all of them on the spot. “Being associated with Bing was a major step up.”
Persuading Gibson
As a young man of 26, Les went to Gibson with his solid body electric guitar, nicknamed ""the Log."" Despite its sweet tone and lack of feedback, Gibson turned it down, calling it a ""broomstick with pickups on it."" Les spent the next 10 years trying to convince Gibson to build a solid body electric guitar. Les' friend Leo Fender developed a solid body electric and gave Les a prototype. Les took the Fender Telecaster to Gibson, along with ""the Log."" ""I believe the solid body guitar is going to be very important, and if you don't do something, Fender is going to rule the world."" Les finally persuaded Gibson to design what became one of the most famous guitars in the world, the Les Paul Standard.",
Rail Guitar,One of the prototypes that would lead Les Paul to invent the solid-body electric guitar.,All Ages,1,,No,4,,"Rail Guitar
""This was the direction I was craving to go. I didn't know it yet, but I was on my way to the solid body electric guitar."" Les Paul began experimenting with electrifying his guitar when he was in his early teens. He connected a radio as an amplifier to his acoustic guitar, but he wanted to hear just the strings vibrate and he wanted the strings to vibrate longer. ""Using a short length of steel railroad rail and two railroad spikes, I invented a device that could give me a consistent reference point for my experiments. I took a guitar string and fastened it at each end of the steel rail, using the spikes like a bridge and nut to raise the string so it could be plucked. Then I took a telephone microphone, wired it into Mom's radio for amplification, and placed it on the rail under the string. I soon figured out that the tremendous solidity of the rail allowed the string's vibration to sustain for a longer time, and there was no feedback."" -Excerpted from Les Paul: In His Own Words",
Reactable,Interactive music themed exhibit where guests can adjust the position and orientation of various blocks to modularly make a song. ,,1,,No,1,,,
Seeing Sound,Interactive experience that allows users to play different frequency sound through a tube and observe as the contents of the tube shaped to the sound wave being played. ,,2,,No,2,,"Seeing Sound
How would you measure the speed of sound?
In 1886, August Kundt generated a single frequency of sound - a pure tone inside a tube. Dust inside the tube began to vibrate and dance, forming the outline of the soundwave. Kundt then figured out that the distance between the dancing piles of dust is the wavelength of the sound wave. Since he knew the frequency of the sound wave, he could multiply that number by the wavelength and find the speed of sound in air. ",
The Octopus,"Exhibit that highlights Les Paul's The Octopus, the first ever multi-track recording system. ",,3,,No,5,,"The Octopus
Les got the idea for this monster back in 1953. He wanted true multi-track recording, a device that would allow him to record multiple, independent tracks that were synced together. His friends at Ampex had helped him in the past, and they jumped at the chance to build something so revolutionary. It took them about a year to build it, and it cost Les $14,000. Les wasn't happy. ""The speeds were off, the EQ was unacceptable, and there was a million other bugs that had not been worked out"", said Les. So he shipped it back. Ampex worked on it some more. They shipped it back. This went on for a while. Les still wasn't happy. Four years later, in 1957, Les and his design guy, Rein Narma, finally got it right, and Les was able to record. You're looking at the first true 8-track recorder, the machine that changed music forever.",
Theremin,"Experience that allows guests to play the Theremin, an electronic instrument that doesn't require physical contact from the user. ",,1,,No,2,,"Theremin
This instrument is ""hands-off""! The Theremin makes sound without being touched. It works by detecting how close you are to its two antennas. The tube antenna controls pitch (how high or low the sound is), and the flat antenna controls volume (how loud or soft the sound is). Moving your hands closer or farther away from the antennas changes the electric charge, which the theremin translates into sound.",
Bernoulli Table,Early-learning experience where guests can view Bernoulli's principle in action with plastic balls. ,3 - 7,3,"aerodynamics, physics",No,2,1 - 2 mins,"Bernoulli's Principle & Flight
Slower moving fluids (liquid or gas) exert more pressure than faster moving fluids. An aircraft's wing is curved on top and flat on the bottom. Air traveling over the top of the wing moves faster than under the wing. This generates higher pressure on the bottom of the wing, causing lift.",
Energy Into Motion,A four-stroke piston engine which guests can hand crank and ignite to operate.,5 - 10,2,"engines, pistons, simple machines, physical activity",No,3,~1 min,"Energy Into Motion
The force of the explosion drives a piston downward. The piston drives a connector rod. The connector rod drives the crankshaft. The crankshaft turns the up and down motion of the engine into a circular motion that drives the wheels.",
Excavator,Life-sized excavator which guests can control to scoop wood chips.,6 - 12,2,"construction, engines, simple machines, fluid dynamics",No,2,5 - 10 mins,"Multiplying the Multiplier
A lever can help you lift a boulder. A lever and a hydraulic cylinder can help you move a mountain. On this excavator, each hydraulic cylinder is attached to a moving part of the excavator. The pressure from the hydraulic pump is multiplied by the cylinder and again by the boom, arm, and bucket, which act like levers.
The Hydraulic Circuit
A hydraulic circuit is kind of like an electrical circuit.
There are hoses instead of wires and fluid instead of electricity. Instead of the electromotive force (Volts) pushing electrons along, a pump pushes fluid through the circuit. In a hydraulic circuit, the engine turns the hydraulic pump. The pump pushes fluid through a hose to the control valve. Valves choose the route the fluid takes. For instance, the valve can route the fluid to extend or retract the cylinder's piston. The pistons inside the cylinders extend and contract the arm, and the bucket.
Why Hydraulic Power?
• Simplicity! Eliminate the gears, cams, chain drives, and pulleys.
• Efficiency! Fewer moving parts means a more efficient machine!
• Power! Transform small forces into incredibly large forces!
• Control! Manage large forces with small forces!
• Flexibility! Transmit force into difficult spaces!
FORCE
/FÖRS/
A push. A pull. A force is an interaction that changes the motion of an object.
PRESSURE 
/PRESHER/
Force exerted over a given area.",
Flight Simulator,Simulation experience where guests can digitally take control of an airplane using realistic controls. ,All Ages,1,"planes, flight, aerodynamics, simulator",Yes,1,5 - 10 mins,*No central copy,
Fluid Power,"Using fluid dynamics, the user is able to spin a series of fans elsewhere in the exhibit. ",10 - 18,3,"fluid dynamics, ",No,4,1 - 2 mins,"Fluid Power, Fluid Freedom.
Hydraulic power frees you from gears, cams, chain drives, and incredibly heavy motors. It allows you to design all kinds of wild and wonderful machines capable of doing incredible things.
Fluid Power is Flexible
Hydraulic Fluid transmits pressure in every direction, but fluid pressure can be guided easily through hoses. Hoses are small and bendable. You can route them wherever you need them to go. Hydraulic pumps are small and light. You can place them almost anywhere on your machine.",
Four-Cycle Engine,Basic piston engine that highlights the four main steps in a piston engine's process. ,8 - 18,2,"engine, pistons, simple machines",No,5,1 min,"I: INTAKE
The piston moves downward and pulls a mixture of fuel and air into the cylinder. The intake valve is open.
2: COMPRESSION
The piston moves upward compressing the mixture of fuel and air. Both the intake valve and the exhaust valves are closed.
3: COMBUSTION
The mixture of compressed fuel and air is ignited by a spark from a spark plug. The force of the explosion drives the piston downward and provides the power to turn the crankshaft.
4: EXHAUST
The exhaust valve opens. The piston moves upward pushing the exhaust out of the engine. Ideally, at 800 revolutions per minute (rpm) a spark plug fires 400 times.",
Helicopter Sim,Simulated helicopter controls that allows guests to manipulate basic controls while learning what they do. ,All Ages,1,"simulator, aerodynamics, flight",No,3,2 - 3 mins,"Collective Pitch Control
The Collective Control is the up and down control. If the helicopter is level, this will make it to go up or down, but if the helicopter is tilted forward, it will increase the speed.
Tail Rotor Pedals
The Tail Rotor Pedals, or Anti-Torque Pedals, are used to turn the helicopter to the left or to the right. The pilot pushes the left pedal to increase the pitch of the tail rotor and turn to the left. Pushing the right pedal decreases the pitch of the tail rotor and turns the helicopter to the right.
Cyclic Control Stick
The Cyclic Control Stick (Joystick) moves the helicopter forward and backward. Moving the stick forward and back will point the nose of the helicopter up or down. This is accomplished by changing the angle of the rotor blades.",
Power Density,"In this exhibit, visitors can directly compare different power outputs. Using hydraulics, they can lift themselves off the ground, showcasing its high power density. This experience is contrasted with an electric engine, which, due to its lower power density, cannot lift the user.",10 - 18,3,"power density, energy, physics, batteries",No,4,1 - 2 mins,"Power Density
This small hydraulic pump is all you need to lift a bunch of your friends. It would take an electric motor about 10x larger and heavier to lift the same bunch of friends. Hydraulic pumps have a very high power density. There's a whole lot of power in a small package.
156LBS
A 40 hp A40-5 airplane engine weighs about 156 lbs.
520LBS
A 40 hp electric motor weighs about 520 lbs.
40LBS
A 40 hp hydraulic pump weighs about 40 lbs.",
Air Cars,"Users assemble cars and test them to see how far they can travel. Once ready, they can set the pressure of a launcher and watch the affects it has on their creation.",4 - 12,1,"aerodynamics, physics, cars, friction",No,2,4 - 6 mins,"Where Does Energy Come From?
Your little race car runs on the energy stored in compressed air. You pumped the air into the car using the compressor. The energy you used to pump air into your car comes from the food you eat. The energy stored in the food you eat comes, directly or indirectly, from the sun.
Did You Know?
For every action there is an equal (in size) and opposite (in direction) reaction. Air rushes out of the car in one direction pushing the car in the other direction.
TRY OUT DIFFERENT CARS TO SEE HOW THEY COMPARE",
Air Rockets,Guests use bottles and pressurized air to build their own rockets that can be launched up into the air.,4 - 12,1,"aerodynamics, rockets, Isaac Newton, gravity, motion, physics",No,2,4 - 10 mins,"Blast Off
A rocket's engine is also called a reaction engine after Newton's Third Law. Incredibly hot exhaust gas rushes downward pushing the rocket upward into space.
Did You Know?
It took nearly 300 years from the time Sir Isaac Newton mathematically described Gravity and Motion to the time Neil Armstrong took his historic first step on the moon.",
